source_name,event_date,event_title,event_description,location_description,location_accuracy_km,landslide_category,landslide_trigger,landslide_size,landslide_setting,fatality_count,event_import_source,latitude,longitude,country_name,admin_division_name,gazetteer_closest_point,gazetteer_distance,year,month,season,severity
Times of India,2018-06-01,Uttarkashi-Lambgaun-Kedarnath Route Landslide near Kuteti Devi,"The Uttarkashi-Lambgaun-Kedarnath route was blocked near Kuteti Devi temple after a heavy landslide. It was reopened in a few hours. A strong thunderstorm has hit the area on Friday, causing the landslide.","SH-15, Bhatwari, Uttarkashi, Uttarakhand, 249193",1.0,landslide,rainfall,1.0,infrastructure,0.0,GLC,30.72203108,78.44517325,0,Uttaranchal,Uttarkashi,1.31,2018,6,monsoon,low
english.samaylive,2011-06-07,"Rishikesh-Badrinath hwy., near Sirobgarh(Sirobagad), Rudraprayag district, Uttarakhand","Jun 7 (PTI) Rishikesh-Badrinath national highway was blocked today for traffic after a landslide near Sirobgarh in Rudraprayag district of Uttarakhand.Rocks, stones and soil in large quantities came down to the road this morning due to rainfall in the region, official sources said.Nearly 700 vehicles carrying nearly thousands of tourists were stranded on both sides of the highway, they said.Border Roads Organisation is trying to clear the landslide, they said.  -----  Uttarakhand experienced pleasant weather today as rains lashed most of its parts, triggering landslides at a few places in which a boy was seriously injured in Rudraprayag district.The boy, whose identity is yet to be known, was hit by a boulder on Rishikesh-Badrinath national highway at Sirobagad area of Rudraprayag district this afternoon, police said.","Rishikesh-Badrinath hwy., near Sirobgarh(Sirobagad), Rudraprayag district, Uttarakhand",5.0,landslide,rainfall,2.0,unknown,0.0,GLC,30.2414,78.908,0,Uttaranchal,Srinagar,7.47,2011,6,monsoon,low
Mizoram Express,2010-09-13,"near Tuivawl(?), Aizawl-Champhai rd, Aizawl district, Mizoram","Sep 15, 2010  AIZAWL: Aizawl-Champhai road also was blocked by landslides in two places near Tuivawl and Tuichang.  ZONET Champhai Corr. said, the road block near Tuivawl was cleared while men are still at work till in the afternoon to clear the road block near Tuichang.","near Tuivawl(?), Aizawl-Champhai rd, Aizawl district, Mizoram",25.0,landslide,rainfall,2.0,unknown,0.0,GLC,23.591,92.9296,0,Mizoram,Baktawng,10.95,2010,9,monsoon,low
My Republica,2016-09-18,Four of a single family killed in Baglung landslide,"Four members of a same family were buried to death by a landslide that occurred at Ringlang, Bungadobhan-4 in Baglung district on Sunday night.   A big rock had fallen along with the landslide on a house of Bhim Kumari Roka, 38, killing all four family members. The deceased have been identified as the widow's daughter Indra Kumari, 14, son Indrajit, 12, and nine-year-old daughter Mayadevi, according to chief of the District Police Office, Baglung Chakra Bahadur Singh.   Rescue works were delayed as the incident occurred during night time, according to the police. The incident site is some 115 kilometers away from the district headquarters.   “Locals noticed the incident only in the morning although the landslide occurred at night,” according to Dhana Bahadur Roka, a relative of the deceased family.   Villagers cleared up the debris and pulled out the bodies on Monday morning. A group cremation of the deceased was performed the same day after post-mortem at Burtibang Primary Health Pos","Ringlang, Bungadobhan-4 in Baglung district, Nepal",10.0,landslide,rainfall,2.0,unknown,4.0,GLC,28.282927,83.583154,1,Dhawalagiri,Bega,17.64,2016,9,monsoon,medium
Arunachal Times,2017-07-01,Landslide blocks road,Landslide near Waii International Hotel blocks Mowb-II-Zero Point Road,"Bhalukpong, West Kameng, Arunachal Pradesh",1.0,landslide,rainfall,1.0,infrastructure,0.0,GLC,27.01145644,92.64204045,0,Arunachal Pradesh,Digbaljuli,19.46,2017,7,monsoon,low
thaindian,2009-09-09,"Bilaspur and Mandi towns, Chandigarh-Manali National Highway-21, Himachal Pradesh","The Chandigarh-Manali highway has been closed at various places between Bilaspur and Mandi towns since Wednesday night due to landslides triggered by uninterrupted rain in the region for the past two days,","Bilaspur and Mandi towns, Chandigarh-Manali National Highway-21, Himachal Pradesh",5.0,landslide,rainfall,2.0,unknown,0.0,GLC,31.5494,76.9001,0,Himachal Pradesh,Sundarngar,1.77,2009,9,monsoon,low
himvani,2010-07-25,Dharamsala roads,"Meanwhile, intermittent rains disrupted normal life in Dharamsala, Solan and Nahan among other places as roads were blocked due to landslides. Dharamsala was wettest in the region with 86.4 mm rains,",Dharamsala roads,10.0,landslide,rainfall,2.0,unknown,0.0,GLC,32.2067,76.3641,0,Himachal Pradesh,Dharmsala,4.54,2010,7,monsoon,low
mizoramexpress.com,2010-09-16,"Taithu village, Churanchandpur district, Mizoram, Manipur","Sep 16, 2010  Rengkai: Landslide struck Taithu village in Churachandpur district of Manipur at around 3.00 AM on Thursday morning and sources said at least 22 people were inside the two houses that were completely destroyed. The village lies in a landslide-prone area and has witnessed several land slips in the past.  Earlier, sources said that at least 22 people were missing in the disaster. However, by 4.15 AM village elders who took a roll call said: “Luckily, no one was hurt in the incident. But the houses of Pu Remvel and Pu Rama were completely destroyed.”  Later, it was learnt that some of the youths were still awake when the landslide struck and they managed to alert their friends. “All of them somehow jumped out safely…some through the windows…some through the doors,” the source said.","Taithu village, Churanchandpur district, Mizoram, Manipur",5.0,landslide,rainfall,2.0,unknown,0.0,GLC,24.3069,93.125,0,Manipur,Parbung,7.1,2010,9,monsoon,low
Indian Express,2015-03-22,Jammu-Srinagar national highway,"Meanwhile, many of vehicles were lined along the Jammu-Srinagar national highway following the landslides and snowfall at various places since Sunday. Sources said that most of the vehicles that were allowed to ply to Jammu from Srinagar on Sunday were stranded between Chenani and Kheri as nearly 50 meters of road had vanished under landslide.",Jammu-Srinagar national highway,50.0,landslide,snowfall_snowmelt,2.0,infrastructure,0.0,GLC,33.3343,75.1969,0,Jammu and Kashmir,Gund,11.06,2015,3,non_monsoon,low
thehimalayanbeacon.com,2010-08-20,"many locations around Namchi, Sikkim","Posted by Barun Roy on August 21st, 2010  Namchi: The heavy down pour last two days resulted in much damages at two Gram Panchayat units Lingee-Sokpay and Payoung-Kaw under Yangyany Block Administrative Centre. Kubernath Timshina, Panchayat President of Payoung-Kaw GPU, informs that in the wake of a huge landslide the family members and live stock of Ambika Prashad Adhakari of Millde Payoung have been shifted to other safe place since his house was heavily damaged by the slide.  The houses of Hemlal Adhakari and Rabilal Adhakari of Middle Payoung are also on the verge of collapse due to a heavy mud slip from the new cutting of PWD road. At Lingee village, following heavy rainfall the kitchen of Bhakti Maya Dabhari was completely buried by landslide and her house was also partly damaged. In Dara Karhaha ward of Payoung-Kaw Gram Panchayat Unit, the house of Tek Bdr. Rai was heavily damaged by the new cutting of PMGSY road and if the rain continues for one more day he has to be shifted to","many locations around Namchi, Sikkim",10.0,complex,rainfall,2.0,unknown,0.0,GLC,27.167,88.3652,0,Sikkim,Kalimpong,15.21,2010,8,monsoon,low
google,2011-09-17,"Sulichaur village,Nepal","Seven people, two of them children, were killed on Saturday when a landslide triggered by heavy monsoon rains buried a remote village in western Nepal, police said. Police and army rescuers were sent to the area to reach survivors after part of the hillside above Sulichaur village broke away and smashed into nine houses below, police inspector Bibek Kumar Sha told AFP.The landslide injured 17 villagers, he said, and damaged shops in the settlement, which lies in the rugged highlands of Rolpa district, one of Nepal's poorest areas, 280 kilometres (175 miles) west of Kathmandu.","Sulichaur village,Nepal",10.0,landslide,rainfall,2.0,unknown,7.0,GLC,28.25,82.7311,1,Rapti,Jelbang,14.24,2011,9,monsoon,medium
Tribune India,2016-07-26,"Jwagdhar village, Sangrah, Sirmaur district, Himachal Pradesh, India","Two women were killed and two injured when a wall of their house collapsed following a landslide at Jwagdhar village in the Sangrah sub-division of Sirmaur district last night. The landslide was triggered due to downpour which lashed the area last evening. Women who were sleeping in the rear room were killed while those sleeping in the adjoining room escaped with minor injuries. Those killed include 16-year-old girl Sima Devi and her aunt Kanso Devi. Sima’s mother Naina Devi and sister Monica, who were sleeping in the other room, were injured in the incident. Neighbours rushed to help the family but by the time the two women were pulled out from the debris they had died.","Jwagdhar village, Sangrah, Sirmaur district, Himachal Pradesh, India",1.0,rock_fall,rainfall,3.0,unknown,2.0,GLC,30.6935,77.4266,0,Himachal Pradesh,Nahan,19.91,2016,7,monsoon,medium
dnaindia,2010-07-22,"near Panthal, between Ramban and Ramsu(?), on Jammu-Srinagar hwy, Jammu and Kashmir","The Amarnath pilgrims were today stranded on Jammu-Srinagar highway due to landslides triggered by heavy rains between Ramban and Ramsu.  A batch of 2244 pilgrims, which had left here in a fleet of 49 vehicles around 5am, was not allowed to proceed further by the authorities as landslides had occurred due to heavy rains near Panthal,  ","near Panthal, between Ramban and Ramsu(?), on Jammu-Srinagar hwy, Jammu and Kashmir",10.0,landslide,rainfall,2.0,unknown,0.0,GLC,33.3893,75.203,0,Jammu and Kashmir,Gund,4.97,2010,7,monsoon,low
The Arunachal Times,2017-06-17,Fatal landslide in Mawjrong,"Landslide after incessant rains kills boy, parents injured","Khatarshnong Laitkroh, East Khasi Hills, Meghalaya",1.0,landslide,rainfall,2.0,natural,1.0,GLC,25.43807422,91.79904872,0,Meghalaya,Rangshken,4.82,2017,6,monsoon,medium
thehimalayantimes,2010-07-13,"Sattale, Rapti highway, between Dang and Salyan, Tulsipur municipality, Rapti","2010-07-13 7:08 PM  Transport service on Tulsipur-Salyan-Rukum section of the Rapti Highway was disrupted since Tuesday morning due to landslides triggered by incessant rainfall on Tuesday.  Landslide at Sattale in Tulsipur Municipality-1 has blocked the road, according to Tulsipur Area Police Office.  Vehicles to Salyan and Rukum from Dang have been stranded on the road till Tuesday afternoon. A dozer from District Road Division has been called to the site to clear the road. ","Sattale, Rapti highway, between Dang and Salyan, Tulsipur municipality, Rapti",25.0,landslide,rainfall,2.0,unknown,0.0,GLC,28.2929,82.2617,1,Rapti,Lawamjula,2.66,2010,7,monsoon,low
myRepublica,2014-08-29,Birtamod village of Belkot VDC-1 in Nuwakot district,Three members of a family were killed when a landslide buried their house at Birtamod village of Belkot VDC-1 in Nuwakot district on Friday morning.,Birtamod village of Belkot VDC-1 in Nuwakot district,5.0,landslide,unknown,2.0,unknown,3.0,GLC,27.8315,85.1638,1,Bagmati,Beklot,1.62,2014,8,monsoon,medium
google,2009-10-06,Thapakhana village in Parbat (Parvat) district,"Four members of a family were also killed in Thapakhana village in Parbat district late Tuesday night, he added. Landslides triggered by torrential rains have killed at least 34 people in various parts of western Nepal, government officials said Wednesday.",Thapakhana village in Parbat (Parvat) district,10.0,landslide,rainfall,2.0,unknown,4.0,GLC,28.1778,83.7,1,Dhawalagiri,Khaldanda,12.24,2009,10,non_monsoon,medium
thestatesman.net,2007-09-11,"National Highway 31A, between Singtam and Rangpo","occurred in afternoon, slide was 40 m long, disrupted traffic","National Highway 31A, between Singtam and Rangpo",5.0,debris_flow,rainfall,2.0,unknown,0.0,GLC,27.2084,88.4909,0,Sikkim,Tista,14.59,2007,9,monsoon,low
E-Pao,2017-07-08,Landslides along Lamlang River,"Incessant rains cause landslides along river. Article: huge tracts of land covering nine different major paddy field areas Hongchao, Litji, Nitrei, Rashoi, Khaying, Yakrei, Chanwoi, Napik and Mirang measuring about 12 hectares have been destroyed by land slip.","Ukhrul Central, Ukhrul, Manipur",100.0,landslide,rainfall,2.0,natural,0.0,GLC,25.06466676,94.27420555,0,Manipur,Kalapahar,32.56,2017,7,monsoon,low
My Republica,2016-09-02,Landslide at Gajuri,"Landslide killed six-year-old Ram Chepang, early this morning","Gajuri, Dhading, Nepal",5.0,landslide,unknown,1.0,unknown,1.0,GLC,27.769034,84.854632,1,Bagmati,Trisuli,6.57,2016,9,monsoon,medium
Kathmandu Post,2015-08-07,Kalon cliff in Api Municipality-6,Some villages in Darchula district have been cut off with the district headquarters Khalanga for the past one week due to the landslide at Kalon cliff in Api Municipality-6.,Kalon cliff in Api Municipality-6,10.0,rock_fall,unknown,2.0,infrastructure,0.0,GLC,29.8587,80.5547,1,Mahakali,Tham,21.85,2015,8,monsoon,low
State Times,2015-03-30,16 dead in Chadoora,"Search and rescue workers retrieved the body of seven- year-old boy Ahmad Hajam from the debris of a house at village Laden in Chadoora tehsil this morning, a police official said, with this toll increased to 16. Laden village witnessed landslide caused by heavy rains on intervening night of Sunday and Monday.",Laden in Chadoora,5.0,landslide,rainfall,2.0,unknown,16.0,GLC,33.9445,74.799,0,Jammu and Kashmir,Kasba,1.94,2015,3,non_monsoon,high
business-standard,2012-08-20,"Reasi, kashmir","A youth was killed in a landslide triggered by heavy rains in Reasi district of Jammu and Kashmir, officials said today. The incident occurred late last night when the debris fell on a tempo traveller on Katra-Reasi road, they said. Seven others in the vehicle had a narrow escape, they said adding all of them were on their way to Katra-base camp of Mata Vaishno Devi from Nowshera area of Rajouri district.","Reasi, kashmir",1.0,landslide,rainfall,2.0,unknown,1.0,GLC,33.0829,74.8333,0,Jammu and Kashmir,Riasi,0.49,2012,8,monsoon,medium
Quakemap,2015-05-03,trail between Phillim and Lokpa,25 army personnel has been helicoptered in and are currently working their way up from Phillim,trail between Phillim and Lokpa,5.0,landslide,unknown,1.0,unknown,0.0,GLC,28.4202,84.8996,1,Gandaki,Ku-la-ko,19.67,2015,5,non_monsoon,low
nepalnews,2010-08-23,"Kakanda VDC-7(?), Makwanpur district","Tuesday, 24 August 2010 12:43   At least five persons were killed due to floods and landslides triggered by heavy rainfall in many parts of the country on Monday.  Similarly, landslide buried Laisi Chepang in Kakada VDC-7 in Makwanpur district.","Kakanda VDC-7(?), Makwanpur district",10.0,landslide,rainfall,2.0,unknown,1.0,GLC,27.6041,84.8603,1,Narayani,Trisuli,24.81,2010,8,monsoon,medium
morungexpress,2010-10-10,"Lower Chandmari area, PWD department, Kohima, Manipur","Today, a government quarter belonging to PWD department and three private houses in Lower Chandmari area, Kohima started to sink around 6 am. Informing the media, a concerned citizen, Temjentiba, stated “I want to make the concerned authority aware of the damage and arrange necessary measures to help the effected victims who are like you and me. As a responsible citizen I’m sharing this with the rest of the people.” It was estimated that altogether, four houses were completely sunk and damages estimated to be worth 40 to 50 lakhs of rupees.","Lower Chandmari area, PWD department, Kohima, Manipur",1.0,landslide,rainfall,2.0,unknown,0.0,GLC,25.6623,94.1072,0,Nagaland,Naga Hills,20.2,2010,10,non_monsoon,low
ukpress.google,2008-06-14,"Itanagar-Naharlagun, Arunachal Pradesh","bodies pulled from debris in and around Itnagar, 300 mud huts washed away at banks of Dikrong river","Itanagar-Naharlagun, Arunachal Pradesh",25.0,landslide,rainfall,3.0,unknown,21.0,GLC,27.0998,93.6287,0,Arunachal Pradesh,North Lakhimpur,49.75,2008,6,monsoon,high
sananews,2012-02-19,"Khooni Nullah on the Srinagar-Jammu Highway, Ramban District","RAMBAN/SRINAGAR, (SANA): Six people including four of a family were killed in a mishap at Khooni Nullah on the Srinagar-Jammu Highway. Police said that a van bearing registration number JK04A-8621 came under shooting stones and landslides this morning, resulting in the death of six persons and injuries to four others traveling in the vehicle. “The occupants in the van were trapped under heavy boulders and stones,” witnesses said, adding that six of the injured who were taken to district hospital Ramban where they were declared brought dead. ","Khooni Nullah on the Srinagar-Jammu Highway, Ramban District",10.0,complex,unknown,2.0,unknown,6.0,GLC,33.2361,75.2441,0,Jammu and Kashmir,Chaunkri,20.73,2012,2,non_monsoon,medium
Himalayan Times,2016-07-31,"Khotang District Prison, Khotang District, Nepal","Estimated location within Khotang District. An almost 50-metre long landslide triggered by incessant rainfall struck the area yesterday. The landslide has put a major building of the jail, a two-roomed building accommodating security personnel and the prison kitchen in danger, according to Jailer Chitrakhar Acharya.  The landslide, that swept way the prison compound, has unleashed terror among inmates.  Jailer Acharya said that the landslide had put female inmates of the prison in jeopardy. The disaster also burst the prison sceptic tank, after which a strong stench has permeated throughout the prison premises. “We need to shift the inmates to a different building if the rain does not cease,” said Acharya.  Acharya said that the prison administration has been informed about the landslide.  The prison is home to 94 male prisoners, 14 female prisoners, and five dependent children at present.  A government team led by CDO Chandra Bahadur Karki inspected the prison today.  Acharya said tha","Khotang District Prison, Khotang District, Nepal",50.0,landslide,rainfall,2.0,unknown,0.0,GLC,27.1748,86.775,1,Sagarmatha,Sun  Kosi,25.78,2016,7,monsoon,low
Telegraph,2015-08-13,IIT Campus in Mandi,"The footage which was captured near the IIT Campus in Mandi Himaachal Pradesh, India - shows people screaming and running for cover as the mountain-side collapses.",IIT Campus in Mandi,5.0,landslide,unknown,2.0,infrastructure,0.0,GLC,31.7756,76.9876,0,Himachal Pradesh,Mandi,8.56,2015,8,monsoon,low
hindustantimes,2012-08-21,"Barnoi, Bandipora, Kashmir","An entire village on the edge of Line of Control in Gurez valley of North Kashmir was inundated on Tuesday night after heavy rains triggered land-slides and flashfloods in frontier district of Bandipora. Seven jawans of BSF's 113 battalion were injured while one was still missing when  their camp got buried under a landslide after the rains in Barnoi village after being hit by a land slide.""Seven of the men were rescued while one is still missing,"" said BSF spokesperson K.N Tiwari adding that none of the rescued men were severely injuries and operations are on to find the missing jawan.","Barnoi, Bandipora, Kashmir",5.0,landslide,rainfall,2.0,unknown,0.0,GLC,34.6113,74.9499,0,Jammu and Kashmir,Wampor,15.04,2012,8,monsoon,low
Tribune India,2017-04-17,Landslide in Sainj valley,Landslide due to water seepage in hill from pipe. Article: Danger persists for the residents of Rella Panchayat in Sainj valley of district Kullu in Himachal Pradesh after a massive landslide occurred in the area because of the leakage in the NHPC Parbati Power Project tunnel. Villagers living downside the hill heard the voice of landslide last night and informed the local administration.,"Sainj, Kullu, Himachal Pradesh, India",5.0,landslide,construction,2.0,natural,0.0,GLC,31.76419233,77.29184098,0,Himachal Pradesh,Manglaor,14.1,2017,4,non_monsoon,low
nepalnews,2008-07-24,Khaptad VDC in Achham district.,frequent landslides caused by continuous rainfall have displaced all residents,Khaptad VDC in Achham district.,50.0,landslide,rainfall,2.0,unknown,0.0,GLC,29.0833,81.3333,1,Seti,Karnali,15.65,2008,7,monsoon,low
gulf-times,2011-07-19,Nuwakot district,"Four members of the same family were killed in the Nuwakot district when a mudslide swept away their home, the Kantipur news portal reported. Another landslide buried two people inside their home in nearby Kaski district. A man died in the Khotang district, 250km to the east, when his shop was buried by another landslide. Heavy monsoon rains triggered flash floods and landslides across the country, displacing hundreds of people and killing dozens in recent weeks. Yesterday, Kathmandu recorded the highest rainfall of the year, according to the weather department. Hundreds of people are killed in Nepal every year in floods and landslides brought on by seasonal rains, according to the South Asian Floods organisation, a forum for information exchange between affected countries.  ~~~`BABURAM LAMICHHANE  NUWAKOT: Four members of a family were killed when a landslide swept away their house at Narjamandap VDC-5 in Aaldanda of the district at around 10 pm on Tuesday.  The deceased have been ide",Nuwakot district,10.0,landslide,rainfall,2.0,unknown,4.0,GLC,27.9358,85.1893,1,Bagmati,Beklot,10.31,2011,7,monsoon,medium
Indian Express,2016-05-18,"Bilaipur, Hailakandi district, Assam, India","One of two landslides in Bilaipur triggered by the same rainfall event. Ten people were killed in landslides in Karimganj and Hailakandi districts in Barak Valley in Assam on Wednesday following incessant rains. In neighbouring Hailakandi district, two incidents of landslide killed four persons at Bilaipur and a six-year old boy at Ramchandi area, police officials said. The debris fell on two houses where the victims were sleeping early in the morning, they said. NDRF and police have been engaged in rescue and relief operations.","Bilaipur, Hailakandi district, Assam, India",1.0,landslide,rainfall,2.0,unknown,2.0,GLC,24.5202,92.7239,0,Assam,Umednagar,12.05,2016,5,non_monsoon,medium
hindu,2010-07-29,"Uttarkāshi : Landslips, triggered by heavy rain, blocked two key highways connecting Rishikesh, Gangotri and Badrinath in Uttarakhand on Thursday, le*","Landslips, triggered by heavy rain, blocked two key highways connecting Rishikesh, Gangotri and Badrinath in Uttarakhand on Thursday, leaving hundreds of people stranded. The landslips occurred on the Rishikesh-Gangotri National Highway at Nalupani in Uttarkashi district , sources in the Disaster Management and Mitigation Centre said. The landslides struck the NH-108 at Nalupani area, officials said in Dehradun. Uttarkashi has been receiving heavy rains for the past few days. A devotee was washed away in the swollen Bhagirathi river on the way to Gaumukh from Gangotri when a temporary bridge collapsed due to heavy rains three days ago. ",None,10.0,landslide,rainfall,2.0,unknown,0.0,GLC,30.7467,78.4517,0,Uttaranchal,Uttarkashi,1.89,2010,7,monsoon,low
The Morung Express,2018-05-12,Mizoram Landslide near Zemabawk,"A landslide occurred at a stone quarry at 7:30am. The massive landslide killed four people, two minor girls and two others, who were working at the quarry. The landslide happened after incessant rains over the past few days. There have been reports saying that at least 10 people were working at the site when the landslide happened on Saturday morning.","near Zemabawk, Aizawl, Mizoram, 796017",1.0,landslide,rainfall,2.0,human_modified,4.0,GLC,23.73672831,92.7516868,0,Mizoram,Aizwal,5.74,2018,5,non_monsoon,medium
Times of India,2017-04-30,Landslides along Gramphu-Kaza road,"Heavy snowfall causes numerous avalanches around Kunzum pass, landslides reported along Gramphu-Kaza road","Lahul, Lahul & Spiti, Himachal Pradesh, India",50.0,landslide,snowfall_snowmelt,1.0,infrastructure,0.0,GLC,32.3071683,77.60234008,0,Himachal Pradesh,Chandra,33.61,2017,4,non_monsoon,low
theshillongtimes.com,2011-08-16,"Garo Hills, Tura","torrential rains from seasonal monsoon, fatalities occurred when landslides buried houses, roads and bridges severely damaged, extensive damage to property and livestock","Garo Hills, Tura",5.0,landslide,rainfall,2.0,unknown,6.0,GLC,25.5144,90.2167,0,Meghalaya,Tura,1.52,2011,8,monsoon,medium
Himalayan Times,2017-06-04,Landslide in Tapeljung,Rain causes landslide to block Mechi highway,Mechi highway near the Khokse River at Dokhu area of Phuling Municipality in Taplejung district.,0.0,landslide,rainfall,2.0,infrastructure,0.0,GLC,27.33861278,87.67107225,1,Mechi,Libang,11.07,2017,6,monsoon,low
Red Cross - Field reports,2007-08-10,Dhading,landslide also reported in Panchthar but coordinates could not be found,Dhading,25.0,complex,rainfall,2.0,unknown,6.0,GLC,27.863,84.914,1,Bagmati,Dhading,0.15,2007,8,monsoon,medium
The Tribune India,2018-10-13,Sanwara Landslide,"Road traffic disrupted for 2.5 hours due to major landslide near Sanwara that spread 40m across National Highway (NH5). Several landslides occurred during rains, but the surface had settled and the landslide was triggered by excavation to make the highway wider.",National Highway 5 near Sonwara,10.0,landslide,construction,1.0,infrastructure,0.0,GLC,30.89560904,77.00451279,0,Himachal Pradesh,Kalka,9.22,2018,10,non_monsoon,low
