source_name,event_date,event_title,event_description,location_description,location_accuracy_km,landslide_category,landslide_trigger,landslide_size,landslide_setting,fatality_count,event_import_source,latitude,longitude,country_name,admin_division_name,gazetteer_closest_point,gazetteer_distance,year,month,season,severity
Hindustan Times,2017-02-28,Mehar Area Landslide in Ramban District Along Highway,Landslides on Tuesday forced closure of the Jammu-Srinagar national highway yet again stranding scores of vehicles carrying passengers and goods. Fresh landslides in Mehar area of Ramban district led to the disruption of traffic on the strategic highway in Jammu and Kashmir.,"Mehar, Ramban district, Jammu and Kashmir, India",25.0,landslide,snowfall_snowmelt,2.0,infrastructure,0.0,GLC,33.288297,75.178026,0,Jammu and Kashmir,Gund,16.29,2017,2,non_monsoon,low
Times of India,2014-08-20,near Meeru on Chulling-Tapri road,A landslide in Kinnaur district resulted in the death of two persons as a huge mound of earth fell on their vehicle on Chulling-Tapri road on Wednesday night. The ill-fated Tata-407 truck was on its way to Rampur from Pooh.,near Meeru on Chulling-Tapri road,5.0,landslide,unknown,2.0,infrastructure,2.0,GLC,31.5216,78.1346,0,Himachal Pradesh,Oling,3.25,2014,8,monsoon,medium
The Kathmandu Post,2017-06-30,Landslide destroys house,"Persistent rain and flooding in region. Landslide sweeps away house, kills 3 and critically injures 3.","Amden (??), Myadlung Municipality, Eastern Development Region, Nepal",25.0,landslide,rainfall,2.0,natural,3.0,GLC,27.18732399,87.50256183,1,Koshi,Hathikharka,19.73,2017,6,monsoon,medium
nepalnews,2010-08-25,"Birgha VDC(Birgha Archale VDC), Syangja district","Thursday, 26 August 2010 10:2  At least seven people were killed in floods and landslides triggered by incessant rainfall across the country within the past few days.  In landslide related incidents, Tara Bahadur Majhi was buried alive when his house at Birgha VDC in Syangja district caved in on Wednesday, while 11-year-old Priti Nemwang was buried alive in a landslide at Nawamidanda in Panchthar district on Tuesday.","Birgha VDC(Birgha Archale VDC), Syangja district",5.0,landslide,rainfall,2.0,unknown,1.0,GLC,28.0401,83.8901,1,Gandaki,Bahakot,7.31,2010,8,monsoon,medium
The Assam Tribune,2017-08-26,Senapati District Mudslide,A massive mudslide at Chakhumei in Senapati district on August 26 last washed away 22 houses. Due to flooding from continuous intense rainfall.,"Senapati, Mao-Maram, Senapati, Manipur",5.0,mudslide,flooding,2.0,human_modified,0.0,GLC,25.26049558,94.01914123,0,Manipur,Kalapahar,16.88,2017,8,monsoon,low
The Kathmandu Post,2017-07-01,Fatal landslide in Rajwara,"Heavy rains cause flooding throughout mideast+east Nepal, landslide kills 1, 2 missing","Rajwara, Gaumukhi Rural Municipality, Nepal",10.0,landslide,rainfall,2.0,natural,3.0,GLC,28.27909521,83.00633062,1,Rapti,Thapagaon,12.27,2017,7,monsoon,medium
nepalnagariknews.blogspot,2009-09-07,Laaduk VDC in Dolakha district,Two women have been killed after being buried in a mudslide at Laaduk VDC in Dolakha district. They died when the mudslide buried them while digging for the red soil at Bhimanei in Laaduk-5 at 7 am. ,Laaduk VDC in Dolakha district,10.0,mudslide,mining,2.0,unknown,2.0,GLC,27.7667,86.1334,1,Janakpur,Barahbise,23.03,2009,9,monsoon,medium
Z News,2015-08-01,Gangotri highway,At least 500 people were left stranded after a landslide blocked a highway in Uttarakhand on Saturday.,Gangotri highway,50.0,rock_fall,rainfall,2.0,infrastructure,0.0,GLC,31.0358,78.8578,0,Uttaranchal,Dhumku,13.42,2015,8,monsoon,low
heraldsun,2011-07-15,Rukum district in the mid-western mountains,"BANKE/NUWAKOT: At least 16 persons died and five others were injured in separate incidents of landslides triggered by incessant rainfall in Rukum and Nuwakot districts today morning.  Thirteen persons, including 10 of a family, were killed after a landslide swept away their house in Rukum while three of a family were killed in a landslip in Nuwakot.  According to Rukum Assistant Chief District Officer Arjun Kumar Bhandari, the landslide swept away two houses at Basandanda and Githakot of Ward No 1 and 2 in Purtimkanda VDC.  In Githakot, Udiram (53), his wife Kali (48), son Khadak (28), daughter-in-law Pawali (23), grandsons Roshan (5) and Ekraj (2) were killed after the landslide buried his house. Udiram’s daughter Gita (25), her husband Rudra Bahadur Budhathoki (33), their sons Navaraj (4) and Jivan (2) were also killed in the incident. Udiram’s daughter and son-in-law along with their kids had come to his house to mark Saune Sankrati.  In Basandanda, Dhansingh Gharti’s son Ramesh (4)",Rukum district in the mid-western mountains,5.0,landslide,rainfall,3.0,unknown,13.0,GLC,28.7434,82.4753,1,Rapti,Jajarkot,25.54,2011,7,monsoon,high
Deccan Herald,2014-09-23,Hatsingimari,"A child was killed in a landslide in Dhubri district’s Hatsingimari, while one person was electrocuted in Guwahati where a body floating on river Bharalu was also recovered, state government officials said.",Hatsingimari,5.0,landslide,rainfall,1.0,unknown,1.0,GLC,25.7238,89.9032,0,Assam,Manikarchar,21.17,2014,9,monsoon,medium
Face to Face,2018-08-02,Narayangarh-Muglin road Landslides,Landslides at Ghumaune and Jalbire occurred in the morning obstructing travel along Narayanghat-Mugling Highway.,"Kabilas, Narayani. Bharatpur metropolis-29, Ghumaune and Ichhakamana municipality-6, Jalbire",5.0,landslide,unknown,1.0,infrastructure,0.0,GLC,27.82419341,84.46603959,1,Gandaki,Narayangarh,16.03,2018,8,monsoon,low
The Landslide Blog,2012-05-05,Seti debris flow,"Almost two years ago, on 5th May 2012, a catastrophic debris flow swept down the Seti River in Nepal, killing over 70 people.",Pokhara,5.0,complex,unknown,3.0,natural,72.0,GLC,28.52206817,84.07696086,1,Gandaki,Ngawal,13.52,2012,5,non_monsoon,high
ekantipur.com,2013-07-22,"Kuwakot, Syangja District","In Syangja district, landslides killed three personsÑthree-month-old Mina BK, Rita Bhattarai and Dil Bahadur SarkiÑin Sekham, Kuwakot and Chinnebas. A landslide in Chinnebas destroyed a school building and a suspension bridge.","Kuwakot, Syangja District",5.0,landslide,rainfall,2.0,unknown,1.0,GLC,27.9142,83.7876,1,Gandaki,Mitel,21.39,2013,7,monsoon,medium
Etemaa Daily,2017-05-20,Badrinath highway landslide,Landslide on highway to Hindu temple Badrinath kills multiple and traps/blocks thousands of pilgrims,"Highway to Badrinath, Uttarakhand",25.0,landslide,rainfall,3.0,natural,13.0,GLC,30.73315585,79.49231617,0,Uttaranchal,Saraswati,1.49,2017,5,non_monsoon,high
Hindustan Times,2017-04-26,Landslide on Senki View road,"Article: ""Incessant rainfall for the past one week has flooded large areas of Arunachal Pradesh’s capital town Itanagar and caused landslides and road blocks at many points.  The PWD took swift action to clear the debris caused by the landslide at Senki View and Donyi Polo Road, an official report said on Thursday.""","Senki View, Itanagar, Papum Pare, Arunachal Pradesh, India",1.0,landslide,rainfall,1.0,infrastructure,0.0,GLC,27.104022,93.61156568,0,Arunachal Pradesh,North Lakhimpur,51.23,2017,4,non_monsoon,low
e-pao.net,2011-07-24,NH 37,"Mudslide blocks Imphal-Jiri Road Source: Hueiyen News Service  Imphal, July 24 2011: Apart from vast land agricultural areas of the state submerged under water, the incessant rain in the past few days has began to take its toll to the people of the state which in the most recent has blocked the Imphal-Jiri Highway near Barak River.  The mudslide which block the NH 37 between Barak River and Santi Khunou was occurred today afternoon at around 12.30 pm.  The huge mudslide which covered an area of more than 200 feet has totally blocked the NH 37 from Imphal to Jiri make it impossible for vehicles to ply along the highway.  According to BRTF officials, the clearing works of the mudslide will take at least two or three days depending on the weather condition.  Adding the woe of the BRTF officials in clearing the mudslide area is the incessant rain which still keeps pouring in the area.  In order to avoid any disturbances in the clearing work, BRTF officials appealed to the transporters and ",NH 37,50.0,landslide,rainfall,2.0,unknown,0.0,GLC,26.5836,93.0038,0,Assam,Simanagaon,16.72,2011,7,monsoon,low
thehimalayanbeacon.com,2010-08-26,"NH-31A at Topakhani tunnel(?) and fruit preservation factory(?) and Chisopani bridge(?), near Singtam and Gangtok and Rangpo, Sikkim","Gangtok, Aug. 27: Seven landslides struck a 15km stretch of NH31A and crippled traffic on Sikkim’s only road link with the rest of the country after heavy rain lashed the Himalayan state last night. A 31-year-old woman was washed away in one of the flash floods that followed.  The landslides, four of them major ones, occurred between 32 Mile and Singtam on NH31A, the stretch littered with slush and debris that came tumbling down from the hillside late last night and early this morning.  The landslides left at least 100 vehicles coming from Siliguri stranded on the Bengal-Sikkim border at Rangpo for sometime. While some passengers tried to walk and cross the slides, others returned to Siliguri. “The vehicles — there were lots of them — were told to stay put at Singtam for the night,” said A.K. Singh, the executive engineer of Project Swastik of the Border Roads Organisation that is in charge of the highway. The first major landslide nearest to Gangtok was at the mouth of Topakhani, a 12","NH-31A at Topakhani tunnel(?) and fruit preservation factory(?) and Chisopani bridge(?), near Singtam and Gangtok and Rangpo, Sikkim",10.0,landslide,rainfall,2.0,unknown,0.0,GLC,27.2319,88.497,0,Sikkim,Tista,12.45,2010,8,monsoon,low
Nagaland Post,2015-08-19,Phesama,Over 200 vehicles were stranded along NH-29 Phesama landslide area for almost four hours on Wednesday.,Phesama,5.0,landslide,rainfall,2.0,infrastructure,0.0,GLC,25.6278,94.1051,0,Nagaland,Sochumei,21.24,2015,8,monsoon,low
Hindustan Times,2017-06-09,Landslides throuhgout Lunglei District,"Landslides + flash floods after heavy rain hit throughout Lunglei District, Tlabung town hard hit. Death toll is 10, article does not specify specific landslide deaths. Article: Altogether 165 buildings were destroyed and 299 houses damaged by landslide, mudslide and flood in Lunglei","Tlabung, Lungsen, Lunglei, Mizoram",100.0,landslide,rainfall,2.0,unknown,10.0,GLC,22.90813548,92.47207294,0,Mizoram,Hruizam,14.42,2017,6,monsoon,medium
Rising Kashmir,2015-02-26,Ramsu,"Two people were today killed while two others were seriously injured when the vehicle they were travelling in was hit by a landslide on the Jammu- Srinagar national highway near here, a police official said.",Ramsu,50.0,landslide,unknown,2.0,infrastructure,2.0,GLC,33.3376,75.1922,0,Jammu and Kashmir,Gund,10.72,2015,2,non_monsoon,medium
The Kathmandu Post,2018-09-01,Nuwakot Landslide,Landslide damaged bridge on highway at Nuwakot during monsoon season.,"Nuwakot, Lumbini, Nepal",5.0,landslide,rainfall,2.0,infrastructure,0.0,GLC,27.96216117,83.05240785,1,Lumbini,Rajiya,16.12,2018,9,monsoon,low
thejakartapost,2012-08-28,Okhaldhunga district,"Incessant rains for some days have triggered landslides at the Okhaldhunga district headquarters recently.  Landslides are occurred at different places of the Okhaldhunga bazaar putting the headquarters in peril. Recently, a landslide swept away the main road linking local Ram bazaar and Ganesh Chowk thereby disrupting the transportation and people's mobility. Some houses, three-story party office of the CPN-UML, and the Bal Mandir Primary School are in immediate need of shift due to the landslide.",Okhaldhunga district,5.0,landslide,rainfall,2.0,unknown,0.0,GLC,27.3172,86.5,1,Sagarmatha,Okhaldhunga,0.37,2012,8,monsoon,low
Hindustan Times,2012-09-19," Chungthang and Pegong. Houses, between Rangma and Chungthang ","At least twenty one bodies, including those of the Indo-Tibetan Border Police (ITBP) and the Border Roads Organisation (BRO) personnel, have so far been found while eight persons are still missing due to flash flood and landslides in remote areas of North Sikkim, official sources said  The dead include four from the ITBP, two of their family members, and 12 junior officers from the BRO. Other victims were casual labourers, officials said.Most of the casualties are reported from Rangma range.Landslides were caused by heavy rains since September 19, Deputy Commissioner North district T W Khangsherpa said.There were about nine landslides blocking the main road between Chungthang and Mangan in the district, he said. Several landslides blocked the main roads between Chungthang and Pegong. Houses along Lachen river between Rangma and Chungthang were washed away in flash floods along Lachen river."," Chungthang and Pegong. Houses, between Rangma and Chungthang ",10.0,landslide,rainfall,3.0,unknown,0.0,GLC,27.6558,88.605,0,Sikkim,Sikkim,11.88,2012,9,monsoon,low
Nagaland Post,2016-08-25,Mudslide near Kohima,"Torrential rainfall on Thursday triggered heavy mudslide at the old dumping zone area, around 11 kms away from the state capital. North traffic control room informed that the debris was cleared around 6.30 p.m. Vehicles travelling to Kohima and those vehicles from Kohima headed to Dimapur were diverted through the bye-pass route.","Near Kohima, Nagaland, India",25.0,mudslide,rainfall,1.0,natural,0.0,GLC,25.660517,94.104931,0,Nagaland,Naga Hills,20.49,2016,8,monsoon,low
The Tribune,2017-06-29,Landslide on Manali-Leh highway,"Hundreds of commuters stranded on the blocked Manali-Leh National Highway, large number of vehicles are stuck in traffic jam, tourists stranded. Caused by incessant rainfall on 6/27. Baralacha pass isolated.","Patseu, Lahul & Spiti, Himachal Pradesh",25.0,landslide,rainfall,2.0,infrastructure,0.0,GLC,32.76390852,77.28272548,0,Himachal Pradesh,Gushai,37.45,2017,6,monsoon,low
Tribune India,2016-07-17,"Railway tunnel a few kilometres from the Haridwar railway station, between Haridwar and Dehradun, Uttarakhand, India","A mudslide hit the Lodhamandi railway track on the Haridwar-Dehradun route here today, affecting the movement of several trains. According to information, local residents spotted a huge mound of mudslide at 9.20 am at the entrance of a railway tunnel, a few kilometres from the Haridwar railway station. The police and railway officials were informed. MK Singh, Superintendent of the Haridwar railway station, said the mud debris was cleared from the track at 2.30 pm, after which the train traffic was restored. The Amritsar-Dehradun train had to be called back to the Haridwar railway station after the officials concerned received information about the blockage on the track. Other trains, which were affected, include Delhi-Dehradun Shatabdi, Link Express and Dehradun-Bandra Express.","Railway tunnel a few kilometres from the Haridwar railway station, between Haridwar and Dehradun, Uttarakhand, India",0.0,mudslide,rainfall,2.0,infrastructure,0.0,GLC,29.9551,78.1677,0,Uttaranchal,Jwalapur,6.66,2016,7,monsoon,low
ABP News,2016-08-29,NH-05 near Chaura village,Incessant rains have caused massive rockslides blocking the National Highway-5 that connects the state with Punjab.,NH-05 near Chaura village,5.0,rock_fall,rainfall,2.0,infrastructure,0.0,GLC,31.5728,77.8561,0,Himachal Pradesh,Sarahan,8.25,2016,8,monsoon,low
Republica,2014-07-18,Baglung,"Traffic along Maldhunga-Beni road section, linking Maldhunga of Parbat and Beni of Myagdi, has been obstructed from Friday morning due to landslide. The traffic was obstructed after the landslide triggered following the continuous rainfall buried the road at Phanphane of Nanglibang in Parbat district. Long and short-route vehicles have been stranded due to the traffic obstruction. According to the District Police Office, it was not possible to resume the traffic immediately as rainfall still continues. Police said that they are bringing a bulldozer from Pokhara to resume the traffic. ",Baglung,5.0,landslide,rainfall,1.0,infrastructure,0.0,GLC,28.3048,83.6011,1,Dhawalagiri,Bega,15.37,2014,7,monsoon,low
Kashmir Times,2015-07-12,Seri in Ramban along Jammu-Srinagar National Highway,"One-year old child Sunday died when a car, in which he was travelling along with his family, was struck by a landslide at Seri in Ramban along Jammu-Srinagar National Highway, while continued to remain closed and traffic remained suspended in the wake of landslides, triggered by rains, occurring at several places in Batote-Banihal sector.",Seri in Ramban along Jammu-Srinagar National Highway,1.0,landslide,rainfall,1.0,infrastructure,1.0,GLC,33.2504,75.2102,0,Jammu and Kashmir,Chaunkri,18.62,2015,7,monsoon,medium
E-PAO,2015-08-01,between Chalong and Paraolon,Two landslides between Chalong to Paraolon,between Chalong and Paraolon,10.0,landslide,rainfall,2.0,infrastructure,0.0,GLC,24.1988,94.1016,0,Manipur,Jun,18.35,2015,8,monsoon,low
kantipuronline,2008-08-31,"Kulung VDC, Bhojpur district","80 houses affected, occurred in early morning","Kulung VDC, Bhojpur district",50.0,landslide,rainfall,3.0,unknown,3.0,GLC,27.4385,87.0898,1,Koshi,Dingla,9.75,2008,8,monsoon,medium
Outlook India,2018-08-09,Porter drowned,porter drowned after being pushed by landslide into Kali River,along Kali River between Nazang and Mangti,100.0,landslide,rainfall,2.0,natural,1.0,GLC,29.85124503,80.55415467,1,Mahakali,Tham,21.47,2018,8,monsoon,medium
Info Nepal,2016-07-04,"Maglungkhola Hydro Project, Gumda, Nepal","A landslide caused by incessant rainfall has damaged the Maglungkhola Hydro Project at Gumda in the district. The 25-Kilowatt hydro project was repaired by the locals at their own efforts as it was damaged in last year’s earthquake too. With the obstruction in power supply, about 260 households in the locality are forced to live under the darkness, locals said. Locals have complained that they did not have budget to remove the landslide and repair the hydro project.","Maglungkhola Hydro Project, Gumda, Nepal",10.0,landslide,rainfall,2.0,unknown,0.0,GLC,28.2317,84.8756,1,Gandaki,Ku-la-ko,2.14,2016,7,monsoon,low
Outlook India,2018-09-25,Circular Road Landslide,"Circular road connecting Panjtirthi and Gujjar Nagar was closed due to landslide triggered by heavy rains. A concrete building was damaged, but no casualties were reported.","Circular Road, Panjtirthi - Gujjar Nagar, Jammu City",1.0,landslide,rainfall,2.0,infrastructure,0.0,GLC,32.74103796,74.87509309,0,Jammu and Kashmir,Jammu,4.21,2018,9,monsoon,low
E-PAO,2015-08-11,Tousem,"In a press statement, ZB-AMN General Secretary Dr Gairiangmei Maringmei said due to recent incessant rain, several areas of the Zeliangrong region have experienced landslides.",Tousem,5.0,landslide,rainfall,2.0,unknown,0.0,GLC,25.1019,93.3729,0,Manipur,Brail Range,8.59,2015,8,monsoon,low
Outlook India,2018-09-02,Landslide at Baphukhola Kills 3,"Continuous rainfall in Western Nepal triggered a landslide at Baphukhola in Bahchaur of Saylan district that buried a house, killing 3 children.","Baphukhola, Bagchaur, Saylan, Nepal",5.0,landslide,rainfall,2.0,unknown,3.0,GLC,28.5051914,82.39631687,1,Rapti,Baramelo,7.44,2018,9,monsoon,medium
The hindu.com,2007-09-05,Panthal in Jammu’s Ramban district on Srinagar-Jammu Highway,"occurred on road, disrupted traffic",Panthal in Jammu’s Ramban district on Srinagar-Jammu Highway,50.0,landslide,rainfall,2.0,unknown,0.0,GLC,33.1662,75.3098,0,Jammu and Kashmir,Doda,22.09,2007,9,monsoon,low
eKantipur,2015-06-29,Chyamrangbesi VDC-1 in Kavre district,"The April 25 earthquake and its aftershocks did not cause much damage to Chyamrangbesi, but the tremors have weakened the soil, which are evident in the forms of cracks and fissures on the land. Ninety-one families from Chyamrangbesi have already moved to other villages like Dholahiti, Sunthan and Phirphiredanda.",Chyamrangbesi VDC-1 in Kavre district,5.0,landslide,earthquake,2.0,natural,0.0,GLC,27.4916,85.4416,1,Bagmati,Nepal,14.15,2015,6,monsoon,low
Arunachal Times,2017-06-21,Landslide in Itanagar,Landslide disrupts water supply pipeline,"Poma, 6km away from Itanagar",1.0,landslide,rainfall,1.0,natural,0.0,GLC,27.05880384,93.54136779,0,Arunachal Pradesh,Kaolakhat,48.47,2017,6,monsoon,low
Times of India,2016-08-04,Valley of Flowers near Badrinath,None,Valley of Flowers near Badrinath,5.0,debris_flow,rainfall,2.0,infrastructure,0.0,GLC,30.7386,79.4954,0,Uttaranchal,Saraswati,0.91,2016,8,monsoon,low
The hindu.com,2007-09-02,"Rakhu VDC in Kalikot district, Karnali","rains washed away house, road closures in other locations","Rakhu VDC in Kalikot district, Karnali",10.0,complex,rainfall,2.0,unknown,2.0,GLC,29.184,81.6018,1,Karnali,Rupsa,7.44,2007,9,monsoon,medium
myrepublica,2012-10-01,"Dhupu VDC ,  ",Five bodies have been found in the slush in the Dhunpa stream at Dhupu VDC in the district. The flooded stream has triggered landslide at the village at 11 p.m. on Monday.,"Dhupu VDC ,  ",25.0,landslide,rainfall,3.0,unknown,5.0,GLC,27.4191,87.2714,1,Koshi,Dingla,15.31,2012,10,non_monsoon,medium
The Tribune India,2018-10-19,Acha-Mod Landslide,"Landslide of boulders and mud cut off road that connects the Kashtighar tehsil with the Doda District, around 20 km from the Doda District Headquarters. It is thought that the cause is road construction.","Acha-Mod, Road that connects Kashighar tehsil with Doda District, 20 km from Doda Headquarters, India",25.0,landslide,construction,2.0,infrastructure,0.0,GLC,33.21265327,75.3625123,0,Jammu and Kashmir,Panjan,15.95,2018,10,non_monsoon,low
Khaleej Times,2018-10-30,"Landslide closes highway, 1 dead",A landslide that shut down a stretch of the Jammu-Srinagar highway in Ramban district. One man was kidded after being hit by rubble sliding down mountain sides in Digdol area.,Jammu-Srinagar highway in Digol area,1.0,landslide,rainfall,2.0,infrastructure,1.0,GLC,33.30077774,75.18148186,0,Jammu and Kashmir,Gund,14.88,2018,10,non_monsoon,medium
thehimalayantimes,2010-09-15,"Gulmi, Arghakhanchi and Palpa districts, Lumbini zone","2010-09-16 7:56 PM    BUTWAL: Shortage of daily essential products is seen in hill areas of Lumbini zone.  Landslides triggered by incessant rainfall over the past few days have disrupted vehicular movement on several roads in rural areas of the zone, bringing the supply of daily essentials to a standstill.  Shree Krishna Pokharel, vice-chairman of Rupandehi Trade Association, said landslides have made roads in rural parts of Gulmi, Arghakhanchi and Palpa districts inoperable. (Unsure date: September 13 - 16th)","Gulmi, Arghakhanchi and Palpa districts, Lumbini zone",5.0,landslide,rainfall,2.0,unknown,0.0,GLC,27.8808,83.3395,1,Lumbini,Tansen,20.38,2010,9,monsoon,low
ibnlive.in.com,2013-07-14,"Near Rampur, Himachal Pradesh","Three persons were killed in rain-related incidents in Himachal Pradesh as incessant heavy showers wreaked havoc causing landslides at several places, blocking highways and damaging several houses. A truck driver, who was sleeping in his truck along with two other persons near Rampur in the district, died when his truck got buried under debris following a massive landslide. The body of the driver, Monu, was recovered from the debris while the other two managed to escape, official sources said. Sujanpur Tira in Hamirpur district was wettest in the region with 187 mm of rains till this morning while Nahan and Renuka in Sirmaur district recorded 185 mm and 169 mm rains respectively. The local MeT office has warned of very heavy rains at some places and rains and thundershowers at many places in the state during next 24 hours as a cyclonic circulation, extending up to 0.9 km above sea level, lies over Punjab and adjoining Haryana. Dehra Gopipur received 160 mm rains, followed by Dharamsala","Near Rampur, Himachal Pradesh",10.0,landslide,rainfall,2.0,unknown,1.0,GLC,31.4711,77.6746,0,Himachal Pradesh,Rampur,3.73,2013,7,monsoon,medium
my Republica,2017-10-04,Siddhartha Highway Landslide near Siddhabana,"Two persons were hurt in a landslide near Siddhabana of Tansen-Butwal road section along the Siddhartha Highway Wednesday morning. The landslide also caused the fall of a boulder.  Identities of the injured are yet to be ascertained. Following the incident, the two were rushed to the Lumbini Zonal Hospital for treatment, police said. They were travelling on a motorcycle (Lu 17 Pa 1873) at the time when the incident happened.  The landslide has further damaged the road which was hit by frequent landslides of late. The fresh landslide has disrupted the route, police said.","Siddhartha Rajmarg, Dobhan 32907, Nepal",5.0,landslide,unknown,2.0,infrastructure,0.0,GLC,27.724416,83.469507,1,Lumbini,Butwal,2.2,2017,10,non_monsoon,low
www.newindianexpress.com,2013-07-25,"Quaritok, Uttarkashi, Uttarakhand","Landslides struck Quaritok and Malla villages of Uttarkashi, but there were no immediate reports of any casualty, officials said.","Quaritok, Uttarkashi, Uttarakhand",5.0,landslide,rainfall,2.0,unknown,0.0,GLC,30.8928,78.48,0,Uttaranchal,Uttarkashi,18.13,2013,7,monsoon,low
zeenews.india.com,2013-07-08,"Mundral In Kishtwar District, Jammu And Kashmir","Two teenage girls got buried in landslide while grazing cattle at Mundral in Kishtwar district on Sunday, police said.","Mundral In Kishtwar District, Jammu And Kashmir",10.0,mudslide,rainfall,2.0,unknown,2.0,GLC,33.3118,75.7525,0,Jammu and Kashmir,Ariz,8.11,2013,7,monsoon,medium
